stars;rate;text
4;1;La aplicación está genial. La utilizo siempre y me gusta mucho. Pero con mi nuevo dispositivo Xiaomi tiene problemas. Teniendo habilitada la función "Toca para traducir" el icono flotante nunca se oculta. Cuando lo elimino al icono flotante y copio un texto para traducir, ya no funciona tengo hab
5;1;Muybuena para mis tareas de ingles me a servido mucho a los que hicieron esta aplicacion son unos cracks para crear aplicaciones
5;1;La mejor aplicación puedes traducir sin internet esta app me gusta muchísimo para traducir todo se las recomiendo es la mejor de todas las otras aplicaciones
4;1;Me encata puedo traducir otros idimas si quiero viajar asta sacar una foto y traducirlo. Tampoco tiene anuncios pero quisiera que juncione sin coneci
5;1;Es simplemente el mejor traductor del mundo!! Igual hay bastante para mejorar todavía. Por ejemplo, no es bueno traduciendo expresiones típicas del idioma, porque lo hace literalmente y no le da el significado rea
5;1;Muy buena esta apk llevo más de 7 años utilizando la y he aprendido muchos idiomas. Si decean aprender cualquier idioma muy fácil mente esta es la aplicación indicada, y lo mejor que también se puede utilizar sin
5;1;Me gusta esta app y es muy buena me ayuda a comprender algunas Palabras que no puedo entender
5;1;Nooo manches está aplicación es genial se merece 5 estrellas si es buenísima se las recomiendo no es tan difícil solo pon una foto o camara y listo te la traduse yo quise traducir árabe a español y funci
5;1;Es super útil la aplicación aparte de que podés sacar fotos y te lo traduce.A mi me ayuda mucho con las tareas de inglés y es muy práctico de usar. No solamente tiene para traducir en inglés sino que en otros idiom
5;1;Gracias a esta app he podido comunicarme por todo el mundo, una de las imprescindibles para llevar en el móvil.
5;1;100% recomendable para traducir todo tipo de idiomas qué no conoces o no sabes aun. Una app totalmente gratis al alcance de tu mano y se
5;1;La app está buenísima porque podemos traducir rápido, lo malo es que tenemos que estar copiando y pegando para poder traducir, me gustaría que pudieran la opción de una lupa que pueda traducir el texto que allá en pantalla, estaría muy buena esa actualización
5;1;Me gusta mucho estás ablicasion por qué lo podemos traducir todo hasta un texto en inglés hici que le doy 5 estrella
5;1;Muy buena app, la verdad es muy útil y con muchas modalidades, solo que el único defecto que la veo es que no me deja importar imágenes para traducirlas, así que resulta algo molesto, pero de ahí en más es muy buena
4;1;Esta app me ayuda en todo para ASER las tareas asta para ablar inglés así q se merece todas las estrellas
5;1;Esta es muy buena ,me gusta que cuando presionas conversación aparece una en la esquina de el teléfono y eso te ayudará a hablar con una persona que hable inglés puedes escanear y traducir GRAN TRABAJO CON ESTA APP
3;1;La aplicación podria mejorar, si se puede añadir varias imagenes en la traducción ya que muchas personas la usan para leer comica o manga.
5;1;Y para mi opinión Este es el mejor
4;1;funciona perfecto pero lo que pasa es que aveces dice un cosa y después otra completamente diferente de la misma cosa, será una cosa de la gramática en fin 5 estrellas muy buena App
5;1;Me gusta mucho y le doy 5 estrellas, aunque ahora tengo un problema porque antes podía traducir desde las aplicaciones como Facebook y ahora no puedo quisiera que me hayuden con eso muchas gracias
5;1;Esta aplicación es buena la recomiendo te ayuda a traducir lo que te dicen tus amigos por ejemplo si ellos te ablando en inglés y tú no sabes ablar en inglés solo lo copias y hay te lo traduce lo recomiendo
4;1;Me gustó esta aplicación ya k m ayuda a traducir palabras uno sé cómo se pronuncian y hasta ahorita no tengo ningún problema ,es muy eficaz.
5;1;La app es maravillosa, hay ocasiones que no entiendo algunas palabras de otros idiomas y cuando lo traduzco por aquí lo hace muy bien, 100° porciento recomendada
1;0;La app es una porqueria, pesima, de lo peor que exisate
2;0;Mala, no cumple las espectativas, sinceramente, no se que esperar
1;0;Terrible, lenta, no se puede navegar, sinceramente, no merece ser instalada
1;0;Nada que ver con lo prometido, muy mala aplicacion, terrible
1;0;la peor aplicacion del mundo nunca la instalen lenta
1;0;lenta mala mediocre, perdida de tiempo pesima terrible asco escoria
1;0;una porqueria, nunca la instalen, lenta, demorada pesima, mala
1;0;basura de aplicacion carga lento no la instalen deberian mala basura terrible pesimo
1;0;la verdad es una aplicacion mala, nunca he visto semejante porqueria de aplicacion una estrella
1;0;le doy una estrella porque no se puede dar menos, sinceramente una perdida de tiempo
1;0;de las peores aplicaciones que hay en el mercado, una porqueria
1;0;se demora mucho en cargar, ya no funciona como antes, si es que antes funciono bien
1;0;Deberian cerrar la aplicacion muy lenta y definitivamente pesima pesima terrible
1;0;mala, perversa aplicacion, nunca la instalen, definitivamente una perdida de tiempo y dinero
1;0;robo atraco una perdida de dinero y perdida de tiempo
1;0;perdida de tiempo y perdidad de dinero, mal hecha, terrible mala, una porqueria
1;0;la pero cosa que he visto en mi vida, terrible aplicacion
1;0;asquerosa, inmunda y una perdida de dinero y tiempo, deberian borrarla
1;0;mala, pesima perversa, terrible
1;0;asquerosa, inmunda, lenta, borrenla mala mala mala
1;0;perdida de tiempo, perdida de tiempo, perdida de dinero, perdida de plata
1;0;demorada, lenta, lentisima, nunca la descarguen
1;0;nunca la bajen, pesima, borrenla, desintalenla
1;0;desinstalar, borrar, mala, pesima, una proqueria, porqueria, asquerosa
1;0;malisima, perversa, una basura de app
1;0;abominacion, sucia, perversa, nunca la descarguen
1;0;muchos anuncios, mucha propaganda, pesima aplicacion
2;0;le doy 2 estrellas porque medio me gusto
2;0;le doy 2 estrellas
2;0;le doy dos estrellas
2;0;dos estrellas, porque podria mejorar, pero no esta al nivel
2;0;sinceramente, no creo que valga la pena instalarla, podria mejorar
2;0;podria mejorar la aplicacion, no me gusto
2;0;nada de lo prometido, le doy 2 estrellas por compasion
2;0;le doy 2 estrellas porque no merece mas
2;0;sinceramente, no era lo que esperaba
2;0;No era lo que esperaba, aun puede mejorar pero la aplicacion es mala
2;0;Muchos anuncios y no parece a la publicidad
2;0;nada que ver con lo que promete en la publicidad
2;0;dos estrellas
2;0;dos estrellas
2;0;2 estrellas
2;0;2 puntos
2;0;dos puntos
3;1;mediocre, promedio, sin mejora
3;1;le doy 3 estrellas porque puede mejorar
3;1;puede mejorar, tiene potencial
3;1;le doy esta calificacion porque pasa raspado
3;1;le doy 3 puntos porque es una de las apps gratis y me gustaria
3;1;3 estrellas de calificacion para esta app
3;1;podria mejorar
3;1;tiene potencial
3;1;sinceramente pense que iba a perder el tiempo, pero hace el intento
3;1;basica, mediocre, tres, no merece mas nota
3;1;promedio
3;1;pasa raspado por el 3
3;1;aceptable, pasable, sin pena ni gloria
3;1;regular
3;1;medioano, insignificante, no destaca
3;1;3 estrellas
3;1;3 estrellas
3;1;nada que ver con lo anunciado, pero por lo menos no pierdo el tiempo
3;1;puede mejorar, pueden meterle mas cosas
3;1;puntuacion media, mediano, no destaca
3;1;sin pena ni gloria
3;1;nada que ver, puede mejorar
4;1;buena aplicacion, tiene futuro
4;1;4 estrellas
4;1;puede mejorar, es buena la app
4;1;es buena pero
4;1;muy buena aplicacion, le veo futuro
4;1;cuatro estrellas
4;1;me gusta la aplicacion porque me facilita la vida
4;1;facil de usar, gracias por crear esta aplicacion, pero recomendaria
4;1;facil de usar, me gustaria que le agregaran
4;1;sin duda alguna, una de las mejores aplicaciones, le agregaria
4;1;le asigno 4 estrellas porque no es perfecta pero
4;1;puede que sea no excelente, le doy 4 estellas
4;1;muy buena aplicacion, le veo buen futuro
4;1;buena app, me gustaria que le agregaran
4;1;me gusta mucho el trabajo de ustedes
4;1;buena
4;1;muy buena aplicacion, deberian agregarle una opcion para que haga
4;1;buena aplicacion, no es perfecta, pero me gusta
4;1;gracias por tan buena app, pero recomiendo
4;1;gracias por la facilidad de uso de esta app
4;1;muy buena aplicacion pero
4;1;buenísima pero
4;1;me esta empezandoa gustar esta app pero les recomindo que
4;1;cuatro puntos, cuatro estrellas, cuatro, 4
4;1;buena, le doy 4 estrellas
4;1;4 estrellas porque no es perfecta
5;1;Excelente, sin palabras
5;1;Perfecta, sin comentarios
5;1;Muy buena aplicacion, se gana las 5 estrellas
5;1;Muy buena aplicacion, se gana las cinco estrellas
5;1;muy buena, sin duda alguna excelente
5;1;excelente, perfecta, epica
5;1;epica, sin palabras, me facilita la vida
5;1;5 estrellas
5;1;cinco estrellas
5;1;perfecta
5;1;genial, super buena, buenisma
5;1;gracias por el gran trabajo, muy buena
5;1;gracias por el excelente trabajo
5;1;mucha dedicacion, buen trabajo
5;1;cinco estrellas para esta app
5;1;nada que agregar, 5 estrellas
5;1;hace lo que promete
5;1;cumplio mis espectativas
5;1;cumplio mis espectativas
5;1;no le tenia fe a esta app, cumplio mis espectativas
5;1;5 estrellas
5;1;buenisma, cada vez es mejor esta app
5;1;Percecta, no deseo mejor app
5;1;super buena, me encanta esta app
5;1;excelentisimo
5;1;excelente







